[
  {
    "schemaVersion":"1.0.0","id":"ACL-001","version":"1.0.0","status":"active","domain":"acl","category":"least-privilege","severity":"HIGH","dimensions":["security","best-practice"],
    "condition":{"operator":"acl-policy-check","params":{"rulesPath":"rules","check":"unrestricted-ip-permit"}},
    "content":{"en":{"title":"Unrestricted IPv4 permit","finding":"A reachable rule permits all IPv4 protocols from any source to any destination.","reason":"This is a permit-by-default boundary and can expose traffic not explicitly required.","recommendation":"Replace it with the minimum required sources, destinations and protocols after validating traffic requirements.","fieldExperienceNote":"Direction and attachment context are not available; confirm the policy placement before changing it."},"zh":{"title":"无限制 IPv4 放行","finding":"发现一条可达规则，允许任意源到任意目的的全部 IPv4 协议。","reason":"该规则形成默认放行边界，可能暴露未明确需要的流量。","recommendation":"核实业务需求后，将其收紧到最小必要的源、目的和协议。","fieldExperienceNote":"当前没有方向和挂载点上下文，变更前必须确认策略部署位置。"}},
    "vendors":["cisco-ios","huawei-vrp","h3c-comware","juniper-junos"],"sourceTypes":["configuration"],"evidence":{"selector":"operator-evidence","fields":["sourceLine","sequence","action","protocol","source","destination"],"redactions":[]},
    "references":[{"title":"NIST SP 800-41 Rev. 1 — Guidelines on Firewalls and Firewall Policy","url":"https://nvlpubs.nist.gov/nistpubs/Legacy/SP/nistspecialpublication800-41r1.pdf"}],"fixtures":{"positive":["fixtures/positive.json"],"negative":["fixtures/negative.json"],"boundary":["fixtures/boundary.json"]}
  },
  {
    "schemaVersion":"1.0.0","id":"ACL-002","version":"1.0.0","status":"active","domain":"acl","category":"least-privilege","severity":"MEDIUM","dimensions":["security","best-practice"],
    "condition":{"operator":"acl-policy-check","params":{"rulesPath":"rules","check":"unrestricted-tcp-permit"}},
    "content":{"en":{"title":"Unrestricted TCP permit","finding":"A reachable rule permits all TCP traffic between any source and destination without a destination-port limit.","reason":"The rule is broader than a service-specific allowlist.","recommendation":"Restrict source, destination and destination port to the documented application flow.","fieldExperienceNote":"A broad TCP rule may be intentional for a trusted transit boundary; verify direction and zone context."},"zh":{"title":"无限制 TCP 放行","finding":"发现一条可达规则，允许任意源到任意目的的全部 TCP 流量，且未限制目的端口。","reason":"该规则比面向具体服务的允许列表更宽。","recommendation":"按已确认的应用流量限制源、目的和目的端口。","fieldExperienceNote":"可信中转边界可能有意使用宽泛规则，需核实方向和安全域。"}},
    "vendors":["cisco-ios","huawei-vrp","h3c-comware","juniper-junos"],"sourceTypes":["configuration"],"evidence":{"selector":"operator-evidence","fields":["sourceLine","sequence","action","protocol","source","destination","destinationPort"],"redactions":[]},"references":[{"title":"NIST SP 800-41 Rev. 1","url":"https://nvlpubs.nist.gov/nistpubs/Legacy/SP/nistspecialpublication800-41r1.pdf"}],"fixtures":{"positive":["fixtures/positive.json"],"negative":["fixtures/negative.json"],"boundary":["fixtures/boundary.json"]}
  },
  {
    "schemaVersion":"1.0.0","id":"ACL-003","version":"1.0.0","status":"active","domain":"acl","category":"least-privilege","severity":"MEDIUM","dimensions":["security","best-practice"],
    "condition":{"operator":"acl-policy-check","params":{"rulesPath":"rules","check":"unrestricted-udp-permit"}},
    "content":{"en":{"title":"Unrestricted UDP permit","finding":"A reachable rule permits all UDP traffic between any source and destination without a destination-port limit.","reason":"The rule admits more services than an explicit allowlist.","recommendation":"Limit it to required endpoints and UDP services.","fieldExperienceNote":"Validate application discovery and return-traffic behavior before narrowing the rule."},"zh":{"title":"无限制 UDP 放行","finding":"发现一条可达规则，允许任意源到任意目的的全部 UDP 流量，且未限制目的端口。","reason":"该规则允许的服务范围超过明确允许列表。","recommendation":"限制到必要端点和 UDP 服务。","fieldExperienceNote":"收紧前需核实应用发现和返回流量行为。"}},
    "vendors":["cisco-ios","huawei-vrp","h3c-comware","juniper-junos"],"sourceTypes":["configuration"],"evidence":{"selector":"operator-evidence","fields":["sourceLine","sequence","action","protocol","source","destination","destinationPort"],"redactions":[]},"references":[{"title":"NIST SP 800-41 Rev. 1","url":"https://nvlpubs.nist.gov/nistpubs/Legacy/SP/nistspecialpublication800-41r1.pdf"}],"fixtures":{"positive":["fixtures/positive.json"],"negative":["fixtures/negative.json"],"boundary":["fixtures/boundary.json"]}
  },
  {
    "schemaVersion":"1.0.0","id":"ACL-004","version":"1.0.0","status":"active","domain":"acl","category":"insecure-management","severity":"HIGH","dimensions":["security"],
    "condition":{"operator":"acl-policy-check","params":{"rulesPath":"rules","check":"telnet-permit"}},
    "content":{"en":{"title":"Reachable Telnet permit","finding":"A reachable TCP permit targets destination port 23 (Telnet).","reason":"Telnet does not provide the authentication and transport protection expected for secure remote administration.","recommendation":"Remove the Telnet path or replace it with an approved encrypted management method such as SSH.","fieldExperienceNote":"The port is a protocol indicator, not proof of the application; verify the actual service before remediation."},"zh":{"title":"可达的 Telnet 放行","finding":"发现一条可达 TCP 放行规则，目的端口为 23（Telnet）。","reason":"Telnet 不具备安全远程管理所需的认证与传输保护。","recommendation":"移除 Telnet 路径，或改用经批准的加密管理方式，例如 SSH。","fieldExperienceNote":"端口只能提示协议，不能证明实际应用；整改前应核实服务。"}},
    "vendors":["cisco-ios","huawei-vrp","h3c-comware","juniper-junos"],"sourceTypes":["configuration"],"evidence":{"selector":"operator-evidence","fields":["sourceLine","sequence","action","protocol","source","destination","destinationPort"],"redactions":[]},"references":[{"title":"NIST IR 7966 — Security of SSH Access Management","url":"https://csrc.nist.gov/pubs/ir/7966/final"},{"title":"IANA Service Name and Port Number Registry","url":"https://www.iana.org/assignments/service-names-port-numbers/"}],"fixtures":{"positive":["fixtures/positive.json"],"negative":["fixtures/negative.json"],"boundary":["fixtures/boundary.json"]}
  },
  {
    "schemaVersion":"1.0.0","id":"ACL-005","version":"1.0.0","status":"active","domain":"acl","category":"management-exposure","severity":"MEDIUM","dimensions":["security","manageability"],
    "condition":{"operator":"acl-policy-check","params":{"rulesPath":"rules","check":"ssh-from-any"}},
    "content":{"en":{"title":"SSH permitted from any source","finding":"A reachable TCP/22 permit accepts any source.","reason":"Privileged remote access should be restricted to authorized management paths.","recommendation":"Limit SSH sources to approved management networks or access points.","fieldExperienceNote":"Any source may still be constrained elsewhere; confirm upstream controls and attachment direction."},"zh":{"title":"SSH 允许任意源访问","finding":"发现一条可达 TCP/22 放行规则，源地址为任意。","reason":"特权远程访问应限制在获授权的管理路径。","recommendation":"将 SSH 源限制到批准的管理网段或访问控制点。","fieldExperienceNote":"上游可能已有约束，需确认其他控制措施和挂载方向。"}},
    "vendors":["cisco-ios","huawei-vrp","h3c-comware","juniper-junos"],"sourceTypes":["configuration"],"evidence":{"selector":"operator-evidence","fields":["sourceLine","sequence","action","protocol","source","destination","destinationPort"],"redactions":[]},"references":[{"title":"NIST SP 800-171 Rev. 3 — Remote Access","url":"https://nvlpubs.nist.gov/nistpubs/SpecialPublications/800-171r3/NIST.SP.800-171r3.html"},{"title":"IANA Service Name and Port Number Registry","url":"https://www.iana.org/assignments/service-names-port-numbers/"}],"fixtures":{"positive":["fixtures/positive.json"],"negative":["fixtures/negative.json"],"boundary":["fixtures/boundary.json"]}
  },
  {
    "schemaVersion":"1.0.0","id":"ACL-006","version":"1.0.0","status":"active","domain":"acl","category":"management-exposure","severity":"MEDIUM","dimensions":["security","manageability"],
    "condition":{"operator":"acl-policy-check","params":{"rulesPath":"rules","check":"snmp-from-any"}},
    "content":{"en":{"title":"SNMP permitted from any source","finding":"A reachable UDP/161 permit accepts any source.","reason":"Management-plane polling should be limited to authorized management systems.","recommendation":"Restrict the source to approved monitoring networks and verify the SNMP security version separately.","fieldExperienceNote":"ACL syntax cannot determine the SNMP version, credentials or upstream protections."},"zh":{"title":"SNMP 允许任意源访问","finding":"发现一条可达 UDP/161 放行规则，源地址为任意。","reason":"管理面轮询应仅允许获授权的监控系统。","recommendation":"将源限制到批准的监控网段，并单独核实 SNMP 安全版本。","fieldExperienceNote":"仅凭 ACL 无法判断 SNMP 版本、凭据和上游保护。"}},
    "vendors":["cisco-ios","huawei-vrp","h3c-comware","juniper-junos"],"sourceTypes":["configuration"],"evidence":{"selector":"operator-evidence","fields":["sourceLine","sequence","action","protocol","source","destination","destinationPort"],"redactions":[]},"references":[{"title":"CISA Enhanced Visibility and Hardening Guidance","url":"https://www.cisa.gov/resources-tools/resources/enhanced-visibility-and-hardening-guidance-communications-infrastructure"},{"title":"IANA Service Name and Port Number Registry","url":"https://www.iana.org/assignments/service-names-port-numbers/"}],"fixtures":{"positive":["fixtures/positive.json"],"negative":["fixtures/negative.json"],"boundary":["fixtures/boundary.json"]}
  },
  {
    "schemaVersion":"1.0.0","id":"ACL-007","version":"1.0.0","status":"active","domain":"acl","category":"ordering","severity":"HIGH","dimensions":["connectivity","security","reliability"],
    "condition":{"operator":"acl-policy-check","params":{"rulesPath":"rules","check":"shadowed-rule"}},